Attribute,Description,Valid Values,DependsOn,Properties,Required,Parent,DependsOn Component,Source,Validation Rules
individualIdSource,Database or repository to which individual ID maps,"ABN, ABR, ADNI, BannerSun, BEB_Miller, Clotomics_PAIKEA_MSSM, DongLab, Einstein, Emory, Geschwind, HBTRC, JAX, LIBD, LivingBrainProject_MSSM, MayoBrainBank, Mayo Clinic, MSSM, NDRI, Newcastle, NICHD, NIMH-HBCC, Novogenix, NYBB, Oxford, Penn, PGP, Pitt, Pritzker, Rush, Sestan, SMRI, StemExpress, TAA, UCI_TMF, UCSF, UM-BTB, UW-CDL, Vaccarino, XCell Science, Yale, IU",,,FALSE,DataProperty,,https://repo-prod.prod.sagebase.org/repo/v1/schema/type/registered/sage.annotations-experimentalData.individualIdSource-0.0.15,
ionMode,"Ionization polarity (positive, negative, polar)",,,,FALSE,DataProperty,,https://repo-prod.prod.sagebase.org/repo/v1/schema/type/registered/sage.annotations-experimentalData.ionMode-0.0.2,
isMultiSpecimen,Boolean flag indicating whether or not a file has data for multiple specimens,,,,FALSE,DataProperty,,https://repo-prod.prod.sagebase.org/repo/v1/schema/type/registered/sage.annotations-experimentalData.isMultiSpecimen-0.0.2,
isPostMortem,Was the sample taken after death (true/false),,,,FALSE,DataProperty,,https://repo-prod.prod.sagebase.org/repo/v1/schema/type/registered/sage.annotations-experimentalData.isPostMortem-0.0.2,
lambdaDNAconc,Lambda DNA spike-in concentration in ng,,,,FALSE,DataProperty,,https://repo-prod.prod.sagebase.org/repo/v1/schema/type/registered/sage.annotations-experimentalData.lambdaDNAconc-0.0.2,
ligand,"An ion, molecule or molecular group that binds to a substance to form a larger complex.",,,,FALSE,DataProperty,,https://repo-prod.prod.sagebase.org/repo/v1/schema/type/registered/sage.annotations-experimentalData.ligand-0.0.2,
metaboliteType,Class of metabolite.,"acylcarnitines, acylglycerols, amino acids, bile acids, biogenic amines, carbohydrates, ceramides, cholesterol, cofactors and vitamins, drugs, eicosanoids, endocannabinoids, fatty acids, glycerides, glycerolipid, glycerophospholipid, ketones, lipids, lipoproteins, lysophosphatidylcholine, nucleotides, oxylipins, peptides, phosphatidylcholine, phosphatidylethonalamines, phospholipids, plasmalogens, sphingolipids, steroids, sterols, sugars, TCA cycle metabolites, xenobiotics",,,FALSE,DataProperty,,https://repo-prod.prod.sagebase.org/repo/v1/schema/type/registered/sage.annotations-experimentalData.metaboliteType-0.0.4,
metadataType,"For files of dataSubtype: metadata, a description of the type of metadata in the file.","analytical covariates, assay, biospecimen, data dictionary, individual, manifest, protocol",,,FALSE,DataProperty,,https://repo-prod.prod.sagebase.org/repo/v1/schema/type/registered/sage.annotations-experimentalData.metadataType-0.0.3,
modelSystemType,Type of model system.,"animal, cerebral organoid, immortalized cell line, iPSC, organoid, primary cell culture",,,FALSE,DataProperty,,https://repo-prod.prod.sagebase.org/repo/v1/schema/type/registered/sage.annotations-experimentalData.modelSystemType-0.0.2,
MRItype,The type of MRI assay performed.,"DTI, functional, structural",,,FALSE,DataProperty,,https://repo-prod.prod.sagebase.org/repo/v1/schema/type/registered/sage.annotations-experimentalData.MRItype-0.0.2,
multiconsensusStudyFileID,"F-number assigned by Termo Proteome Discoverer software to different batches (plexes) of RAW (direct Thermo mass spectrometer output) files (F01, F02, etc.)",,,,FALSE,DataProperty,,https://repo-prod.prod.sagebase.org/repo/v1/schema/type/registered/sage.annotations-experimentalData.multiconsensusStudyFileID-0.0.2,
nFemale,Number of female individuals in a pooled Drosophila sample,,,,FALSE,DataProperty,,https://repo-prod.prod.sagebase.org/repo/v1/schema/type/registered/sage.annotations-experimentalData.nFemale-0.0.2,
nIndividuals,Number of individuals in a pooled Drosophila sample,,,,FALSE,DataProperty,,https://repo-prod.prod.sagebase.org/repo/v1/schema/type/registered/sage.annotations-experimentalData.nIndividuals-0.0.2,
nMale,Number of male individuals in a pooled Drosophila sample,,,,FALSE,DataProperty,,https://repo-prod.prod.sagebase.org/repo/v1/schema/type/registered/sage.annotations-experimentalData.nMale-0.0.2,
numberCells,Number of cells or nuclei sequenced,,,,FALSE,DataProperty,,https://repo-prod.prod.sagebase.org/repo/v1/schema/type/registered/sage.annotations-experimentalData.numberCells-0.0.2,
organ,A unique macroscopic (gross) anatomic structure that performs specific functions. It is composed of various tissues. An organ is part of an anatomic system or a body region.,"blood, bone marrow, brain, breast, Bursa Of Fabricius, cerebrospinal fluid, colon, kidney, large intestine, liver, lung, lymph node, mammary gland, nerves, nose, ovary, pancreas, prostate, skin, spleen",,,TRUE,DataProperty,,https://repo-prod.prod.sagebase.org/repo/v1/schema/type/registered/sage.annotations-experimentalData.organ-0.0.4,
passage,Number of times a cell culture has been subcultured,,,,FALSE,DataProperty,,https://repo-prod.prod.sagebase.org/repo/v1/schema/type/registered/sage.annotations-experimentalData.passage-0.0.2,
pcrCycles,Number of PCR cycles to amplify transposased DNA fragments,,,,FALSE,DataProperty,,https://repo-prod.prod.sagebase.org/repo/v1/schema/type/registered/sage.annotations-experimentalData.pcrCycles-0.0.2,
platform,"The specific version (manufacturer, model, etc.) of a technology that is used to carry out a laboratory or computational experiment.","Affy5.0, Affy6.0, Affymetrix Human Gene 1.0 ST Array, AffymetrixU133AB, AffymetrixU133Plus2, Agilent44Karray, BGISEQ-500, Biocrates p180, Biograph mCT, Bionano Irys, Bruker Avance III, confocalImaging, ddSEQ Single-Cell Isolator, DNBSEQ, GAIIx, HiSeq1000, HiSeq2000, HiSeq2500, HiSeq3000, HiSeq4000, HiSeqX, Illumina_1M, Illumina_h650, Illumina_HumanOmni1-Quadv1.0, llumina Infinium General Screening Array 24-Kit v3.0, Illumina MouseWG-6 v2.0 expression beadchip, Illumina_Omni2.5-8, Illumina_Omni2.5-8_v1.1, Illumina_Omni2.5-8_v1.3, Illumina_Omni2pt5M, Illumina_Omni5M, Illumina_Omni5-Quad, IlluminaHumanHap300, IlluminaHumanHap650Yv3_A, IlluminaHumanHT-12_V3_0_R1, IlluminaHumanMethylation450, IlluminaMethylationEPIC, IlluminaInfiniumGSAMD-24v2-0, Illumina_Infinium-HumanMethylation450-BeadChip, IlluminaMiSeq, Illumina NovaSeq 6000, IlluminaNovaseq6000, IlluminaWholeGenomeDASL, Infinium HumanOmniExpressExome, Infinium Omni2.5Exome-8 v1.1, Infinium Omni2.5Exome-8 v1.3, Infinium Omni2.5Exome-8 v1.4, Infinium Omni2.5Exome-8 v1.5, InfiniumPsychArrayBeadChip, LTQOrbitrapXL, MiSeq, NanostringnCounter, NanostringnCounter_MouseADPanel, NextSeq500, NextSeq2000, Olink Target 96, orbitrap, OrbiTrap Fusion, Orbitrap Fusion Lumos, PacBioRSII, PacBio Sequel II, Perlegen300Karray, PsychChip, Q Exactive, Q Exactive HF, Q Exactive Plus, quadrupole time-of-flight, SequenomMultiplex, Signa Premier AIR 3T, Simoa HD-1 Analyzer, time-of-flight, triple quadrupole, Xevo G2 QTOF, Xevo TQ-S",,,TRUE,DataProperty,,https://repo-prod.prod.sagebase.org/repo/v1/schema/type/registered/sage.annotations-experimentalData.platform-0.0.21,
platformLocation,Laboratory where data generation platform was located,,,,FALSE,DataProperty,,https://repo-prod.prod.sagebase.org/repo/v1/schema/type/registered/sage.annotations-experimentalData.platformLocation-0.0.2,
reprogrammingMethod,The method by which source cells were reprogrammed into pluripotent stem cells.,"CytoTune iPS 2.0 Sendai Reprogramming Kit, episomal vectors, Sendai virus",,,FALSE,DataProperty,,https://repo-prod.prod.sagebase.org/repo/v1/schema/type/registered/sage.annotations-experimentalData.reprogrammingMethod-0.0.2,
resolution,Minimum nominal mass-over-charge (m/z) difference detectable,,,,FALSE,DataProperty,,https://repo-prod.prod.sagebase.org/repo/v1/schema/type/registered/sage.annotations-experimentalData.resolution-0.0.2,
sampleStatus,Conditions under which sample is kept,"formalin-fixed, fresh, frozen, paxgene",,,FALSE,DataProperty,,https://repo-prod.prod.sagebase.org/repo/v1/schema/type/registered/sage.annotations-experimentalData.sampleStatus-0.0.2,
samplingAge,Age of the individual when the sample was taken,,,,FALSE,DataProperty,,https://repo-prod.prod.sagebase.org/repo/v1/schema/type/registered/sage.annotations-experimentalData.samplingAge-0.0.2,
samplingAgeUnits,Age at sampling units.,"days, gestational weeks, months, PCW, weeks, years",,,FALSE,DataProperty,,https://repo-prod.prod.sagebase.org/repo/v1/schema/type/registered/sage.annotations-experimentalData.samplingAgeUnits-0.0.2,
scanID,"The ID of a sample, specimen, or individual in a scan or imaging file.",,,,FALSE,DataProperty,,https://repo-prod.prod.sagebase.org/repo/v1/schema/type/registered/sage.annotations-experimentalData.scanID-0.0.2,
SentrixID,BeadChip ID in Illumina array-based assay,,,,FALSE,DataProperty,,https://repo-prod.prod.sagebase.org/repo/v1/schema/type/registered/sage.annotations-experimentalData.SentrixID-0.0.2,
SentrixRowColumn,Position of sample on BeadChip in Illumina array-based assay,,,,FALSE,DataProperty,,https://repo-prod.prod.sagebase.org/repo/v1/schema/type/registered/sage.annotations-experimentalData.SentrixRowColumn-0.0.2,
sex,"Sex assigned at birth, or by sequencing","male, female",,,TRUE,DataProperty,,https://repo-prod.prod.sagebase.org/repo/v1/schema/type/registered/sage.annotations-experimentalData.sex-0.0.2,
sourceCell,"Initial cell type the target cell was derived from, before reprogramming or differentiation.","astrocytes, B-lymphocytes, cord blood stem cells, embryonic stem cells, fibroblast, iPSC, lymphoblast, peripheral blood mononuclear cell",,,FALSE,DataProperty,,https://repo-prod.prod.sagebase.org/repo/v1/schema/type/registered/sage.annotations-experimentalData.sourceCell-0.0.3,
species,The name of a species (typically a taxonomic group) of organism.,"Human, Mouse, Rat, Drosophila melanogaster, Rhesus macaque, Pan troglodytes, Gallus gallus, Sus scrofa",,,TRUE,DataProperty,,https://repo-prod.prod.sagebase.org/repo/v1/schema/type/registered/sage.annotations-experimentalData.species-0.0.2,
specimenID,Identifying string linked to a particular sample or specimen,,,,TRUE,DataProperty,,https://repo-prod.prod.sagebase.org/repo/v1/schema/type/registered/sage.annotations-experimentalData.specimenID-0.0.2,
specimenIdSource,"The repository or database to which a specimenID maps; or, the group or lab that generated the specimen. For cell culture studies, the commercial source or lab that generated the cells.",,,,FALSE,DataProperty,,https://repo-prod.prod.sagebase.org/repo/v1/schema/type/registered/sage.annotations-experimentalData.specimenIdSource-0.0.3,
spectrometerFrequency,The frequency at which a spectrometer causes hydrogen atoms to resonate (in MHz).,,,,FALSE,DataProperty,,https://repo-prod.prod.sagebase.org/repo/v1/schema/type/registered/sage.annotations-experimentalData.spectrometerFrequency-0.0.2,
temperature,Temperature in Celsius (C) relevant to specimen or experimental condition,,,,FALSE,DataProperty,,https://repo-prod.prod.sagebase.org/repo/v1/schema/type/registered/sage.annotations-experimentalData.temperature-0.0.2,
terminalDifferentiationPoint,The terminal differentiation point (TD) of a cell in days.,,,,FALSE,DataProperty,,https://repo-prod.prod.sagebase.org/repo/v1/schema/type/registered/sage.annotations-experimentalData.terminalDifferentiationPoint-0.0.2,
tissue,A tissue is a mereologically maximal collection of cells that together perform physiological function.,"amygdala, amygdaloid complex, anterior cingulate cortex, blood, bone marrow, Buccal Mucosa, Buffy Coat, caudate nucleus, cecum derived fecal material, cerebellar cortex, cerebellum, cerebral cortex, cortical plate, dorsal pallium, Dorsal Root Ganglion, dorsolateral prefrontal cortex, dorsomedial prefrontal cortex, embryonic tissue, fecal material, forebrain, frontal cortex, frontal lobe, frontal pole, fusiform gyrus, hippocampus, head of caudate nucleus, inferior frontal gyrus, inferior temporal cortex, inferior temporal gyrus, inferolateral temporal cortex, insula, insular cortex, left cerebral hemisphere, liver, medial dorsal nucleus of thalamus, medial frontal cortex, medial ganglionic eminence, medial orbital frontal cortex, medial prefrontal cortex, meninges, midbrain, middle frontal gyrus, middle temporal gyrus, nerve tissue, Not Applicable, nucleus accumbens, occipital lobe, occipital visual cortex, olfactory neuroepithelium, orbitofrontal cortex, parahippocampal gyrus, parietal cortex, parietal lobe, plasma, posterior cingulate cortex, posteroinferior parietal cortex, posterior inferior parietal cortex, posterior superior temporal cortex, precentral gyrus, prefrontal cortex, primary auditory cortex, primary motor cortex, primary somatosensory cortex, primary tumor, primary visual cortex, putamen, right cerebral hemisphere, serum, splenocyte, striatum, subgenual anterior cingulate cortex, subgenual cingulate cortex, superior parietal lobe, superior temporal gyrus, temporal cortex, temporal lobe, temporal pole, thalamus, unspecified, ventricular zone, ventrolateral prefrontal cortex, VZ/SVZ, whole brain",,,TRUE,DataProperty,,https://repo-prod.prod.sagebase.org/repo/v1/schema/type/registered/sage.annotations-experimentalData.tissue-0.0.9,
tissueWeight,Mass of tissue specimen in mg,,,,FALSE,DataProperty,,https://repo-prod.prod.sagebase.org/repo/v1/schema/type/registered/sage.annotations-experimentalData.tissueWeight-0.0.2,
TMTType,Specifies how TMT reporter ions are quantified,,,,FALSE,DataProperty,,https://repo-prod.prod.sagebase.org/repo/v1/schema/type/registered/sage.annotations-experimentalData.TMTType-0.0.2,
totalReads,Total number of sequencing reads from a library,,,,FALSE,DataProperty,,https://repo-prod.prod.sagebase.org/repo/v1/schema/type/registered/sage.annotations-experimentalData.totalReads-0.0.2,
visitNumber,"For clinical trials or longitudinal studies, the visit number when the sample was collected",,,,FALSE,DataProperty,,https://repo-prod.prod.sagebase.org/repo/v1/schema/type/registered/sage.annotations-experimentalData.visitNumber-0.0.2,
antibody,An immunoglobulin complex that is secreted into extracellular space and found in mucosal areas or other tissues or circulating in the blood or lymph,,,,FALSE,DataProperty,,https://repo-prod.prod.sagebase.org/repo/v1/schema/type/registered/sage.annotations-immunoAssays.antibody-0.0.2,
antibodyAmount,Amount of antibody used for an assay,,,,FALSE,DataProperty,,https://repo-prod.prod.sagebase.org/repo/v1/schema/type/registered/sage.annotations-immunoAssays.antibodyAmount-0.0.2,
antibodyAmountUnits,Units of measure for the amount of antibody used for an assay,,,,FALSE,DataProperty,,https://repo-prod.prod.sagebase.org/repo/v1/schema/type/registered/sage.annotations-immunoAssays.antibodyAmountUnits-0.0.2,
catalogNumber,"The identifier assigned to a product, usually in the list of products published by a reseller or manufacturer",,,,FALSE,DataProperty,,https://repo-prod.prod.sagebase.org/repo/v1/schema/type/registered/sage.annotations-immunoAssays.catalogNumber-0.0.2,
chromatinAmount,Amount in ug of chromatin used for an assay,,,,FALSE,DataProperty,,https://repo-prod.prod.sagebase.org/repo/v1/schema/type/registered/sage.annotations-immunoAssays.chromatinAmount-0.0.2,
chromatinAmountUnits,Units of measure for the amount of chromatin used for an assay,,,,FALSE,DataProperty,,https://repo-prod.prod.sagebase.org/repo/v1/schema/type/registered/sage.annotations-immunoAssays.chromatinAmountUnits-0.0.2,
lotNumber,A distinctive alpha-numeric identification code assigned by the manufacturer or distributor to a specific quantity of manufactured material or product within a batch,,,,FALSE,DataProperty,,https://repo-prod.prod.sagebase.org/repo/v1/schema/type/registered/sage.annotations-immunoAssays.lotNumber-0.0.2,
vendor,Commercial or institutional source of a component used in an assay,,,,FALSE,DataProperty,,https://repo-prod.prod.sagebase.org/repo/v1/schema/type/registered/sage.annotations-immunoAssays.vendor-0.0.2,
filename,The name of a file.,,,,FALSE,DataProperty,,https://repo-prod.prod.sagebase.org/repo/v1/schema/type/registered/sage.annotations-manifestKeys.filename-0.0.2,
parent,Synapse ID of the folder that data will be uploaded to,,,,TRUE,DataProperty,,https://repo-prod.prod.sagebase.org/repo/v1/schema/type/registered/sage.annotations-manifestKeys.parent-0.0.2,
path,File path where data files that will be uploaded are stored,,,,TRUE,DataProperty,,https://repo-prod.prod.sagebase.org/repo/v1/schema/type/registered/sage.annotations-manifestKeys.path-0.0.2,
BrodmannArea,A segmentation of the cerebral cortex on the basis of cytoarchitecture,,,,FALSE,DataProperty,,https://repo-prod.prod.sagebase.org/repo/v1/schema/type/registered/sage.annotations-neuro.BrodmannArea-0.0.2,
grant,"Grant number including activity code, institute code, and serial number (e.g. U01MH103392)",,,,FALSE,DataProperty,,https://repo-prod.prod.sagebase.org/repo/v1/schema/type/registered/sage.annotations-neuro.grant-0.0.2,
isModelSystem,"",,,,FALSE,DataProperty,,https://repo-prod.prod.sagebase.org/repo/v1/schema/type/registered/sage.annotations-neuro.isModelSystem-0.0.2,
modelSystemName,"","3xTg-AD, 5XFAD, AB42, Abca7A1527GAPOE4Trem2R47H, Abca7KO, Abca7V1599M_rs117187003, Abi3S209F_Aduci, APOE2KI, APOE3KI, APOE4KI, APOE4Trem2R47H, ApoEKO, APPE693Q, AppKOAPOE4Trem2R47H, APPKM650, APPKM670, APPKM670-671NL-PSEN1deltaexon9, APPPS1, B6.Clu, B6.Gfap-APOE4, Bin1.B6, Bin1K358R_Aduci, BRI2-AB42, Cd2ap.B6, Ceacam1KO, Clasp2L163PSNP, CRND8, C57BL6J, hAbetaKI, hAPPAPOE4Trem2R47H, hCR1KIAPOE4Trem2, hTau, hTauTrem2, Il1rapKO, Kif21bT82TSNP, MAPT-P301K, Meox2KOHET, MthfrC677TSNP, Mtmr4V297GSNP, PicalmH458R, Plcg2KO, Plcg2M28LSNP, rTg4510, Snx1D465NSNP, Sorl1A528TSNP, Spi1rs1377416, TREM2, Trem2flox, Trem2KO, Trem2R47H, Trem2R47H_em1_Aduci, Trem2Y38C, TYROBP, TYROBP_KO.KO, TYROBP_WT, TYROBP_WT.KO",,,FALSE,DataProperty,,https://repo-prod.prod.sagebase.org/repo/v1/schema/type/registered/sage.annotations-neuro.modelSystemName-0.0.6,
pH,A scale used to specify the acidity or basicity of an aqueous or other liquid solution,,,,FALSE,DataProperty,,https://repo-prod.prod.sagebase.org/repo/v1/schema/type/registered/sage.annotations-neuro.pH-0.0.3,
PMI,Post-mortem interval,,,,FALSE,DataProperty,,https://repo-prod.prod.sagebase.org/repo/v1/schema/type/registered/sage.annotations-neuro.PMI-0.0.3,
study,Study,"3Dchromatin, Abeta_microglia, ACOM, ACT, ADAMTS7, AD-BXD, AD_ADRD_Exposome, ADMC_ADNI1, ADMC_ADNI2-GO, ADMC_ADNI_BakerLipidomics, ADMC_ADNI_NightingaleNMR, ADMC_UPenn, Aging-PheWAS, APOEPSC, APOE-TR, Banner, BipSeq, BLSA, BPSD_AD_AnimalStudy_NU, BrainGVEX, BroadAstrom109, BroadiPSC, BroadMDMi, CHDWB, CMC, CMC_HBCC, CMC-PEC, CNON, DiCAD, diseasePseudotime, DukeAD_PTSD, ELPSCRNA, Emory_ADRC, EmoryDrosophilaTau, EpiGABA, EpiMap, eQTLmetaAnalysis, FreshMicro, HBI_scRNAseq, HBTRC, HDAC1-cKOBrain, HumanFC, IL10_APPmouse, IntegrativePathwayAnalysis, iPSC, iPSCAstrocytes, iPSC-HiC, iPSCMicroglia, Jax.IU.Pitt_APP.PS1, Jax.IU.Pitt_MicrobiomePilot, Jax.IU.Pitt_PrimaryScreen, Jax.IU.Pitt.Proteomics_Metabolomics_Pilot, Jax.IU.Pitt_StrainValidation, Jax.IU.Pitt_Verubecestat_5XFAD, LBP, LillyMicroglia, LLFS, lncRNA Pilot, MayoeGWAS, MayoLOADGWAS, MayoPilotRNAseq, MayoRNAseq, MC-CAA, MCMPS, MEF2_Resilience, MindPhenomeKB, miR155, MOA-PAD, MODEL-AD_5XFAD, MODEL-AD_APOE4_KI, MODEL-AD_Abca7_APOE4_Trem2, MODEL-AD_APOE4_Trem2, MODEL-AD_Ceacam_KO_APOE4_Trem2, MODEL-AD_hAbeta_KI, MODEL-AD_Harmonization, MODEL-AD_hCR1_KI_on_APOE4_Trem2, MODEL-AD_hTau_Trem2, MODEL-AD_Il1rapKO_APOE4_Trem2_exon2KO, MODEL-AD_Mthfr_APOE4_Trem2, MODEL-AD_Rat_F344, MODEL-AD_Trem2_R47H, MouseHAL, MRGWAS, MSBB, MSBB_ArrayTissuePanel, MSDM, MSMM, MSSMiPSC, mtDNA_AD, NAPS, NHP-Macaque, NHP-Chimpanzee, OFMM, omicsADDS, Organoid_scRNAseq, Plxnb1_KO, RADEL, ROSMAP, ROSMAP_bsSeq, ROSMAP_CognitiveResilience, ROSMAP-IN, ROSMAP_Lipidomics_Emory, ROSMAP_nucleus_hashing, RNAseq_Harmonization, rnaSeqReprocessing, rnaSeqSampleSwap, RR_APOE4, scRNAseq_microglia_wild_ADmice, SEA-AD, SMIB-AD, snRNAseqAD_TREM2, StJude_BannerSun, SUNYStrokeModel, SuperAgerEpiMap, SV_xQTL, SWS, SY5Y_Emory, SY5Y_REST, TASTPM, TauD35, TAUAPPms, TS-RNAseq, TWAS, TyrobpKO, TyrobpKO_AppPs1, U1-70_PrimaryCellCulture, UCI_3xTg-AD, UCI_PrimaryScreen, UCI_Microbiome, UCI_Multiomics, UCI_StrainValidation, UCI_Trem2-R47H_NSS, UCLA-ASD, UCSF_MAC, UFLOR_ABI3_GNGT2, UPenn, VirusResilience_Banner, VirusResilience_iPSC, VirusResilience_LCL, VirusResilience_Mayo.MSBB.ROSMAP, VMC, WallOfTargets, WGS_Harmonization, WGBS Pilot, Yale-ASD",,,TRUE,DataProperty,,https://repo-prod.prod.sagebase.org/repo/v1/schema/type/registered/sage.annotations-neuro.study-0.0.44,
treatmentDose,"Dose of treatment used, including units and timeframe",,,,FALSE,DataProperty,,https://repo-prod.prod.sagebase.org/repo/v1/schema/type/registered/sage.annotations-neuro.treatmentDose-0.0.2,
treatmentType,"","haloperidol, levetiracetam, placebo, clozapine, control, Abeta42 oligomer, Abeta42 fibril, verubecestat",,,FALSE,DataProperty,,https://repo-prod.prod.sagebase.org/repo/v1/schema/type/registered/sage.annotations-neuro.treatmentType-0.0.4,
directionalBSseqLibrary,Indicates whether or not the bisulfiteSeq library is directional,,,,FALSE,DataProperty,,https://repo-prod.prod.sagebase.org/repo/v1/schema/type/registered/sage.annotations-ngs.directionalBSseqLibrary-0.0.2,
dnaExtractionMethod,The general strategy by which the DNA was extracted,,,,FALSE,DataProperty,,https://repo-prod.prod.sagebase.org/repo/v1/schema/type/registered/sage.annotations-ngs.dnaExtractionMethod-0.0.2,
isStranded,Whether or not the library is stranded.,,,,FALSE,DataProperty,,https://repo-prod.prod.sagebase.org/repo/v1/schema/type/registered/sage.annotations-ngs.isStranded-0.0.2,
libraryID,Library ID as provided by the lab,,,,FALSE,DataProperty,,https://repo-prod.prod.sagebase.org/repo/v1/schema/type/registered/sage.annotations-ngs.libraryID-0.0.2,
libraryPrep,The general strategy by which the library was prepared,"amplicon, cellHashing, DNALibraryConstruction, EndItDNAEndRepairKit, KapaHyperPrep, lncRNAenrichment, methylSeq, miRNAenrichment, MULTIseq, PCRfree, polyAselection, proximity ligation, rRNAdepletion, SPLITseq, STARRSeq, SureCell, totalRNA",,,TRUE,DataProperty,,https://repo-prod.prod.sagebase.org/repo/v1/schema/type/registered/sage.annotations-ngs.libraryPrep-0.0.10,
libraryPreparationMethod,Method by which library was prepared,"10x, Accel-NGS 2S Plus, CEL-seq, Drop-Seq, NEBNext, NexteraXT, Omni-ATAC, sac-seq, Smart-seq1, Smart-seq2, Smart-seq4, SMRTbell, TruSeq",,,FALSE,DataProperty,,https://repo-prod.prod.sagebase.org/repo/v1/schema/type/registered/sage.annotations-ngs.libraryPreparationMethod-0.0.8,
libraryType,"The type of library, in assays where samples are barcoded or hashed for multiplexing or each sample has multiple libraries amplified separately before pooled sequencing.","ADT, cDNA, CMO, HTO, LMO, plasmid DNA",,,FALSE,DataProperty,,https://repo-prod.prod.sagebase.org/repo/v1/schema/type/registered/sage.annotations-ngs.libraryType-0.0.3,
libraryVersion,"Library Version: for example, rnaSeq 10x library version",,,,FALSE,DataProperty,,https://repo-prod.prod.sagebase.org/repo/v1/schema/type/registered/sage.annotations-ngs.libraryVersion-0.0.2,
nucleicAcidSource,"","bulk cell, single cell, bulk nuclei, single nucleus, mitochondria, sorted cells, sorted nuclei, cfDNA",,,FALSE,DataProperty,,https://repo-prod.prod.sagebase.org/repo/v1/schema/type/registered/sage.annotations-ngs.nucleicAcidSource-0.0.3,
readLength,The length of the read,,,,TRUE,DataProperty,,https://repo-prod.prod.sagebase.org/repo/v1/schema/type/registered/sage.annotations-ngs.readLength-0.0.2,
readStrandOrigin,The strand from which the read originates in a strand-specific protocol,"forward, reverse",,,FALSE,DataProperty,,https://repo-prod.prod.sagebase.org/repo/v1/schema/type/registered/sage.annotations-ngs.readStrandOrigin-0.0.2,
runType,"","singleEnd, pairedEnd",,,TRUE,DataProperty,,https://repo-prod.prod.sagebase.org/repo/v1/schema/type/registered/sage.annotations-ngs.runType-0.0.2,
sampleBarcode,The nucleotide sequence of the sample barcode used to identify cells from a single sample in cell hashing or multiplexing assays.,,,,FALSE,DataProperty,,https://repo-prod.prod.sagebase.org/repo/v1/schema/type/registered/sage.annotations-ngs.sampleBarcode-0.0.2,
grant,"Grant number including activity code, institute code, and serial number (e.g. U01MH103392)","R01MH106056, R01MH109677, R01MH109715, R01MH110472, R01MH110905, R01MH110920, R01MH110921, R01MH110926, R01MH110927, R01MH110928, R01MH111721, R01MH112751, R01MH117291, R01MH117292, R01MH117293, R21MH105853, R56MH114899, R56MH114901, R56MH114911, U01DA048279, U01MH103339, U01MH103340, U01MH116438, U01MH116441, U01MH116442, U01MH116487, U01MH116488, U01MH116489, U01MH116492, U01MH116529, U01MH119509, U01MH122590, U01MH122591, U01MH122592, U01MH122849",,,FALSE,DataProperty,,https://repo-prod.prod.sagebase.org/repo/v1/schema/type/registered/sage.annotations-PsychENCODESpecific.grant-0.0.2,
study,Study,"3Dchromatin, ASD-lncRNA, BipSeq, BrainDev3D, BrainGVEX, BrainSpan, BrainTF, BrainVar, CMC, CNON, DevBrain-snRNAseq, DopaModel, EpiDiff, EpiGABA, EpiMap, flowRNA_WGBS, HumanFC, iPSC, iPSC-ASD, iPSC-HiC, iPSCNeuroDiff, iPSC-RNA-ATAC, IsoHuB, LIBD_szControl, LIBD-WGBS, LIBD-WGBS-SCZD, lncRNA Pilot, MDDseq, Midbrain Genomics, MouseHAL, MultiomeBrain, m6A-seqAutism, NeuEnhancer, NeuMet, NeuralRloops, NeuREs, NHP-Chimpanzee, NHP-Macaque, PsychiPSCNeurons, PTSDBrainomics, referenceBrain, SCZ-IncRNA, scOrganomics, SingleCellRNAseq, snMultiRegionDevelopmentalTranscriptomics, SZBDMulti-Seq, TS-RNAseq, UCLA-ASD, WGBS Pilot, Yale-ASD",,,TRUE,DataProperty,,https://repo-prod.prod.sagebase.org/repo/v1/schema/type/registered/sage.annotations-PsychENCODESpecific.study-0.0.9,
