Attribute,Description,Valid Values,DependsOn,Properties,Required,Parent,DependsOn Component,Source,Validation Rules
GQN,Illumina gDNA quality score,,,,FALSE,DataProperty,,https://repo-prod.prod.sagebase.org/repo/v1/schema/type/registered/sage.annotations-qc.GQN-0.0.2,
meanCoverage,Total number of bases covered by ATAC-seq reads/size of genome,,,,FALSE,DataProperty,,https://repo-prod.prod.sagebase.org/repo/v1/schema/type/registered/sage.annotations-qc.meanCoverage-0.0.2,
meanGCContent,Mean GC content per sample,,,,FALSE,DataProperty,,https://repo-prod.prod.sagebase.org/repo/v1/schema/type/registered/sage.annotations-qc.meanGCContent-0.0.2,
medianGenes,The median number of genes detected (with nonzero UMI counts) across all cell-associated barcodes,,,,FALSE,DataProperty,,https://repo-prod.prod.sagebase.org/repo/v1/schema/type/registered/sage.annotations-qc.medianGenes-0.0.2,
medianUMIs,The median number of total Unique Molecular Identifier (UMI) counts across all cell-associated barcodes,,,,FALSE,DataProperty,,https://repo-prod.prod.sagebase.org/repo/v1/schema/type/registered/sage.annotations-qc.medianUMIs-0.0.2,
ratio260over230,Ratio of absorbance at 230 nm and 260 nm. Measures protein or other contaminants. Range up to approximately 2.2.,,,,FALSE,DataProperty,,https://repo-prod.prod.sagebase.org/repo/v1/schema/type/registered/sage.annotations-qc.ratio260over230-0.0.2,
ratio260over280,Measure of DNA vs. RNA purity. Range up to approximately 2.0.,,,,FALSE,DataProperty,,https://repo-prod.prod.sagebase.org/repo/v1/schema/type/registered/sage.annotations-qc.ratio260over280-0.0.2,
RIN,RNA Integrity Number,,,,FALSE,DataProperty,,https://repo-prod.prod.sagebase.org/repo/v1/schema/type/registered/sage.annotations-qc.RIN-0.0.2,
validBarcodeReads,Fraction of reads with cell barcodes that match the whitelist,,,,FALSE,DataProperty,,https://repo-prod.prod.sagebase.org/repo/v1/schema/type/registered/sage.annotations-qc.validBarcodeReads-0.0.2,
validHiCContacts,Percentage of reads as valid Hi-C interactions (QC metric),,,,FALSE,DataProperty,,https://repo-prod.prod.sagebase.org/repo/v1/schema/type/registered/sage.annotations-qc.validHiCContacts-0.0.2,
consortium,The name of the consortium,"CMC, PEC, AMP-AD, MODEL-AD, M2OVE-AD, Resilience-AD, BSMN, CSBC, PSON, GENIE, Synodos, DHART SPORE, CDCP, Psych-AD, ELITE, Not Applicable",,,TRUE,DataProperty,,https://repo-prod.prod.sagebase.org/repo/v1/schema/type/registered/sage.annotations-sageCommunity.consortium-0.0.5,
fileFormat,"Defined format of the data file, typically corresponding to extension, but sometimes indicating more general group of files produced by the same tool or software","7z, ab1, abf, avi, bai, bam, bash script, bcf, bed, bed broadPeak, bed gappedPeak, bed narrowPeak, bedgraph, bgzip, bigwig, bim, bpm, cel, chp, csv, czi, dat, DICOM, doc, dup, excel, fam, fasta, fastq, fig, flagstat, gct, gff3, gtf, gzip, hdf, hic, html, hyperlink, idat, idx, jpg, json, locs, maf, md, mov, msf, mtx, pdf, pdresult, pdstudy, pdview, plink, png, powerpoint, Python script, pzfx, R script, raw, RCC, RLF, RData, recal, rmd, sam, sav, sdf, seg, Sentrix descriptor file, sf3, sif, sqlite, sra, svg, svs, Synapse Table, tagAlign, tar, tif, tranches, tsv, txt, vcf, wiggle, xml, zip",,,FALSE,DataProperty,,https://repo-prod.prod.sagebase.org/repo/v1/schema/type/registered/sage.annotations-sageCommunity.fileFormat-0.0.5,
resourceType,The type of resource being stored and annotated,"analysis, curatedData, experimentalData, metadata, report, tool",,,TRUE,DataProperty,,https://repo-prod.prod.sagebase.org/repo/v1/schema/type/registered/sage.annotations-sageCommunity.resourceType-0.0.5,
softwareName,"",,,,FALSE,DataProperty,,https://repo-prod.prod.sagebase.org/repo/v1/schema/type/registered/sage.annotations-tool.softwareName-0.0.2,
